{
  "$schema": "https://json-schema.org/draft/2020-12/schema",
  "$id": "https://subturtle.app/schemas/starter-pack.schema.json",
  "title": "Subturtle starter pack",
  "description": "Beginner (A1) survival chunks for one learning language. Served by the language module's get-starter-pack function: each item's translation is picked from `translations` by the learner's own language.",
  "type": "object",
  "additionalProperties": false,
  "required": ["language", "version", "groups", "items"],
  "properties": {
    "$schema": { "type": "string" },
    "language": {
      "description": "The learning language of every item's text.",
      "enum": ["en", "es", "de", "fr", "it", "sv", "lt"]
    },
    "version": {
      "description": "Raised whenever items are added, removed or reworded.",
      "type": "integer",
      "minimum": 1
    },
    "groups": {
      "description": "Display order of the groups. Every item's group must be listed here.",
      "type": "array",
      "minItems": 1,
      "items": {
        "type": "object",
        "additionalProperties": false,
        "required": ["id", "name"],
        "properties": {
          "id": { "type": "string", "pattern": "^[a-z]+$" },
          "name": { "description": "English label; clients localize by id.", "type": "string", "minLength": 1 }
        }
      }
    },
    "items": {
      "type": "array",
      "minItems": 150,
      "maxItems": 200,
      "items": { "$ref": "#/$defs/item" }
    }
  },
  "$defs": {
    "translation": { "type": "string", "minLength": 1, "pattern": "\\S" },
    "item": {
      "type": "object",
      "additionalProperties": false,
      "required": ["id", "text", "translations", "band", "group"],
      "properties": {
        "id": {
          "description": "<language>-<group>-<nn>. The <group>-<nn> part names the same concept in every pack, so packs can be compared. Never reuse an id for a different chunk.",
          "type": "string",
          "pattern": "^[a-z]{2}-[a-z]+-[0-9]{2}$"
        },
        "text": { "description": "The chunk in the learning language, as a learner would hear it in a video.", "type": "string", "minLength": 1 },
        "lemma": { "description": "Dictionary form of the cloze target word.", "type": "string", "minLength": 1 },
        "form": { "description": "The cloze target exactly as it appears in `text` (blanked on a cloze card).", "type": "string", "minLength": 1 },
        "translations": {
          "description": "Meaning in each checked own language, except the item's own language.",
          "type": "object",
          "additionalProperties": false,
          "minProperties": 5,
          "properties": {
            "fa": { "$ref": "#/$defs/translation" },
            "ar": { "$ref": "#/$defs/translation" },
            "es": { "$ref": "#/$defs/translation" },
            "vi": { "$ref": "#/$defs/translation" },
            "en": { "$ref": "#/$defs/translation" },
            "tr": { "$ref": "#/$defs/translation" }
          }
        },
        "band": { "description": "Frequency band: 1 most common, 3 least.", "enum": [1, 2, 3] },
        "group": { "type": "string", "pattern": "^[a-z]+$" },
        "note": { "description": "Short English usage hint (formality, gender variant, when to say it).", "type": "string", "minLength": 1 }
      },
      "dependentRequired": { "lemma": ["form"], "form": ["lemma"] }
    }
  }
}
