{
  "$schema": "./starter-pack.schema.json",
  "language": "es",
  "version": 1,
  "groups": [
    {
      "id": "greetings",
      "name": "Greetings"
    },
    {
      "id": "polite",
      "name": "Polite words"
    },
    {
      "id": "questions",
      "name": "Questions"
    },
    {
      "id": "needs",
      "name": "Needs and help"
    },
    {
      "id": "time",
      "name": "Time"
    },
    {
      "id": "places",
      "name": "Places and directions"
    },
    {
      "id": "food",
      "name": "Food and drink"
    },
    {
      "id": "travel",
      "name": "Travel"
    },
    {
      "id": "work",
      "name": "Work and study"
    },
    {
      "id": "feelings",
      "name": "Feelings"
    }
  ],
  "items": [
    {
      "id": "es-greetings-01",
      "text": "Hola.",
      "translations": {
        "fa": "سلام.",
        "ar": "مرحبًا.",
        "vi": "Xin chào.",
        "en": "Hello.",
        "tr": "Merhaba."
      },
      "band": 1,
      "group": "greetings"
    },
    {
      "id": "es-greetings-02",
      "text": "¡Buenas!",
      "translations": {
        "fa": "سلام!",
        "ar": "أهلًا!",
        "vi": "Chào!",
        "en": "Hi!",
        "tr": "Selam!"
      },
      "band": 1,
      "group": "greetings",
      "note": "Casual short form of buenas tardes / buenas noches; works at any time of day, even in the morning."
    },
    {
      "id": "es-greetings-03",
      "text": "Buenos días.",
      "lemma": "día",
      "form": "días",
      "translations": {
        "fa": "صبح بخیر.",
        "ar": "صباح الخير.",
        "vi": "Chào buổi sáng.",
        "en": "Good morning.",
        "tr": "Günaydın."
      },
      "band": 1,
      "group": "greetings"
    },
    {
      "id": "es-greetings-04",
      "text": "Buenas tardes.",
      "lemma": "tarde",
      "form": "tardes",
      "translations": {
        "fa": "عصر بخیر.",
        "ar": "مساء الخير.",
        "vi": "Chào buổi chiều.",
        "en": "Good afternoon.",
        "tr": "İyi günler."
      },
      "band": 2,
      "group": "greetings",
      "note": "Used from midday until dark, so it also covers the early evening. After dark, say Buenas noches."
    },
    {
      "id": "es-greetings-05",
      "text": "Buenas noches.",
      "lemma": "noche",
      "form": "noches",
      "translations": {
        "fa": "شب بخیر.",
        "ar": "تصبح على خير.",
        "vi": "Chúc ngủ ngon.",
        "en": "Good night.",
        "tr": "İyi geceler."
      },
      "band": 2,
      "group": "greetings",
      "note": "Also the greeting after dark (Good evening)."
    },
    {
      "id": "es-greetings-06",
      "text": "Adiós.",
      "translations": {
        "fa": "خداحافظ.",
        "ar": "وداعًا.",
        "vi": "Tạm biệt.",
        "en": "Goodbye.",
        "tr": "Hoşça kal."
      },
      "band": 1,
      "group": "greetings",
      "note": "Chao (or chau) is a very common casual alternative."
    },
    {
      "id": "es-greetings-07",
      "text": "Hasta luego.",
      "lemma": "luego",
      "form": "luego",
      "translations": {
        "fa": "بعداً می‌بینمت.",
        "ar": "أراك لاحقًا.",
        "vi": "Hẹn gặp lại sau.",
        "en": "See you later.",
        "tr": "Görüşürüz."
      },
      "band": 1,
      "group": "greetings",
      "note": "Often just means \"bye\", even if you will not see the person again today."
    },
    {
      "id": "es-greetings-08",
      "text": "Hasta mañana.",
      "lemma": "mañana",
      "form": "mañana",
      "translations": {
        "fa": "فردا می‌بینمت.",
        "ar": "أراك غدًا.",
        "vi": "Mai gặp lại nhé.",
        "en": "See you tomorrow.",
        "tr": "Yarın görüşürüz."
      },
      "band": 2,
      "group": "greetings"
    },
    {
      "id": "es-greetings-09",
      "text": "¿Cómo estás?",
      "lemma": "cómo",
      "form": "Cómo",
      "translations": {
        "fa": "حالت چطور است؟",
        "ar": "كيف حالك؟",
        "vi": "Bạn khỏe không?",
        "en": "How are you?",
        "tr": "Nasılsın?"
      },
      "band": 1,
      "group": "greetings",
      "note": "¿Qué tal? is just as common and even more casual. Polite: ¿Cómo está?"
    },
    {
      "id": "es-greetings-10",
      "text": "Bien, gracias.",
      "lemma": "bien",
      "form": "Bien",
      "translations": {
        "fa": "خوبم، ممنون.",
        "ar": "بخير، شكرًا.",
        "vi": "Tôi khỏe, cảm ơn.",
        "en": "Fine, thanks.",
        "tr": "İyiyim, teşekkürler."
      },
      "band": 1,
      "group": "greetings"
    },
    {
      "id": "es-greetings-11",
      "text": "¿Y tú?",
      "translations": {
        "fa": "تو چطور؟",
        "ar": "وأنت؟",
        "vi": "Còn bạn?",
        "en": "And you?",
        "tr": "Ya sen?"
      },
      "band": 1,
      "group": "greetings",
      "note": "Polite: ¿Y usted?"
    },
    {
      "id": "es-greetings-12",
      "text": "¿Cómo te llamas?",
      "lemma": "llamarse",
      "form": "llamas",
      "translations": {
        "fa": "اسمت چیست؟",
        "ar": "ما اسمك؟",
        "vi": "Bạn tên là gì?",
        "en": "What's your name?",
        "tr": "Adın ne?"
      },
      "band": 1,
      "group": "greetings",
      "note": "Polite: ¿Cómo se llama?"
    },
    {
      "id": "es-greetings-13",
      "text": "Me llamo Ana.",
      "lemma": "llamarse",
      "form": "llamo",
      "translations": {
        "fa": "اسم من آنا است.",
        "ar": "اسمي آنا.",
        "vi": "Tôi tên là Ana.",
        "en": "My name is Ana.",
        "tr": "Benim adım Ana."
      },
      "band": 1,
      "group": "greetings"
    },
    {
      "id": "es-greetings-14",
      "text": "Mucho gusto.",
      "lemma": "gusto",
      "form": "gusto",
      "translations": {
        "fa": "خوشبختم.",
        "ar": "تشرفنا.",
        "vi": "Rất vui được gặp bạn.",
        "en": "Nice to meet you.",
        "tr": "Memnun oldum."
      },
      "band": 1,
      "group": "greetings",
      "note": "Encantado is just as common; a woman says Encantada."
    },
    {
      "id": "es-greetings-15",
      "text": "¡Bienvenido!",
      "translations": {
        "fa": "خوش آمدی!",
        "ar": "أهلًا وسهلًا!",
        "vi": "Chào mừng bạn!",
        "en": "Welcome!",
        "tr": "Hoş geldin!"
      },
      "band": 2,
      "group": "greetings",
      "note": "To a woman: ¡Bienvenida! To a group: ¡Bienvenidos!"
    },
    {
      "id": "es-polite-01",
      "text": "Por favor.",
      "lemma": "favor",
      "form": "favor",
      "translations": {
        "fa": "لطفاً.",
        "ar": "من فضلك.",
        "vi": "Làm ơn.",
        "en": "Please.",
        "tr": "Lütfen."
      },
      "band": 1,
      "group": "polite"
    },
    {
      "id": "es-polite-02",
      "text": "Gracias.",
      "translations": {
        "fa": "متشکرم.",
        "ar": "شكرًا.",
        "vi": "Cảm ơn.",
        "en": "Thank you.",
        "tr": "Teşekkür ederim."
      },
      "band": 1,
      "group": "polite"
    },
    {
      "id": "es-polite-03",
      "text": "Muchas gracias.",
      "lemma": "mucho",
      "form": "Muchas",
      "translations": {
        "fa": "خیلی ممنون.",
        "ar": "شكرًا جزيلًا.",
        "vi": "Cảm ơn rất nhiều.",
        "en": "Thank you very much.",
        "tr": "Çok teşekkür ederim."
      },
      "band": 1,
      "group": "polite"
    },
    {
      "id": "es-polite-04",
      "text": "De nada.",
      "translations": {
        "fa": "خواهش می‌کنم.",
        "ar": "عفوًا.",
        "vi": "Không có gì.",
        "en": "You're welcome.",
        "tr": "Rica ederim."
      },
      "band": 1,
      "group": "polite"
    },
    {
      "id": "es-polite-05",
      "text": "Disculpe.",
      "translations": {
        "fa": "ببخشید.",
        "ar": "المعذرة.",
        "vi": "Xin lỗi.",
        "en": "Excuse me.",
        "tr": "Affedersiniz."
      },
      "band": 1,
      "group": "polite",
      "note": "Polite (usted) form; with friends say Disculpa. To get past someone, say Con permiso."
    },
    {
      "id": "es-polite-06",
      "text": "Lo siento.",
      "lemma": "sentir",
      "form": "siento",
      "translations": {
        "fa": "متأسفم.",
        "ar": "آسف.",
        "vi": "Tôi xin lỗi.",
        "en": "I'm sorry.",
        "tr": "Özür dilerim."
      },
      "band": 1,
      "group": "polite",
      "note": "For a quick \"sorry\", e.g. when you bump into someone, say Perdón."
    },
    {
      "id": "es-polite-07",
      "text": "No hay problema.",
      "lemma": "problema",
      "form": "problema",
      "translations": {
        "fa": "مشکلی نیست.",
        "ar": "لا مشكلة.",
        "vi": "Không vấn đề gì.",
        "en": "No problem.",
        "tr": "Sorun değil."
      },
      "band": 1,
      "group": "polite",
      "note": "In reply to an apology, No pasa nada (It's nothing) is very common."
    },
    {
      "id": "es-polite-08",
      "text": "Sí, por favor.",
      "lemma": "favor",
      "form": "favor",
      "translations": {
        "fa": "بله، لطفاً.",
        "ar": "نعم، من فضلك.",
        "vi": "Vâng, cho tôi xin.",
        "en": "Yes, please.",
        "tr": "Evet, lütfen."
      },
      "band": 1,
      "group": "polite"
    },
    {
      "id": "es-polite-09",
      "text": "No, gracias.",
      "lemma": "gracias",
      "form": "gracias",
      "translations": {
        "fa": "نه، ممنون.",
        "ar": "لا، شكرًا.",
        "vi": "Không, cảm ơn.",
        "en": "No, thank you.",
        "tr": "Hayır, teşekkürler."
      },
      "band": 1,
      "group": "polite"
    },
    {
      "id": "es-polite-10",
      "text": "¡Claro!",
      "translations": {
        "fa": "البته!",
        "ar": "بالطبع!",
        "vi": "Tất nhiên rồi!",
        "en": "Of course!",
        "tr": "Tabii ki!"
      },
      "band": 2,
      "group": "polite",
      "note": "Por supuesto is a slightly more formal alternative."
    },
    {
      "id": "es-polite-11",
      "text": "¿Me puede ayudar?",